{
  "appearance": {
    "absoluteMagnitude": -1.52,
    "albedo": [
      0.15,
      0.15,
      0.15
    ],
    "albedoScale": 1,
    "photometry": {
      "model": "lambert",
      "version": "1"
    },
    "presentation": "ellipsoid",
    "textureID": "mars-2k"
  },
  "assets": [
    {
      "byteLimit": 750547,
      "format": "jpeg",
      "height": 1024,
      "id": "mars-2k",
      "path": "texture.jpg",
      "required": false,
      "sha256": "2d187f3e77a98eaa8cea5f4cc722f633c122ef170b9e94ace6b5fb6cbc3f8e01",
      "width": 2048
    }
  ],
  "capabilities": {
    "requires": [
      "kepler-standish-table2a/1",
      "iau-linear/1",
      "lambert/1"
    ]
  },
  "displayName": "Mars",
  "equatorialRadiusM": 3396190,
  "gravitationalParameterM3S2": 42828370000000,
  "id": "mars",
  "kind": "body",
  "orbit": {
    "angleUnit": "deg",
    "distanceUnit": "au",
    "elements": {
      "eccentricity": 0.09336511,
      "inclinationDeg": 1.85181869,
      "longitudeOfAscendingNodeDeg": 49.71320984,
      "longitudeOfPerihelionDeg": -23.91744784,
      "meanLongitudeDeg": -4.56813164,
      "rateEccentricity": 0.00009149,
      "rateInclination": -0.00724757,
      "rateMeanLongitude": 19140.29934243,
      "rateNode": -0.26852431,
      "ratePerihelion": 0.45223625,
      "rateSemiMajorAxis": 9.7e-7,
      "semiMajorAxisAU": 1.52371243
    },
    "epochJD": 2451545,
    "frame": "ecliptic-j2000",
    "model": "kepler-standish-table2a",
    "timeConvention": "tt-as-utc",
    "validityEndJD": 2816795,
    "validityStartJD": 625295,
    "version": "1"
  },
  "parent": "sun",
  "polarRadiusM": 3376200,
  "provenance": {
    "accuracy": "Standish Table 2a fit errors apply; Table 2b corrections are not needed for Mars. Rotation is the secular linear IAU model only; PCK nutation and libration periodic terms are omitted.",
    "attribution": "JPL Solar System Dynamics (orbit); NAIF / IAU Working Group (rotation); Solar System Scope / INOVE (texture).",
    "coverage": "Heliocentric Mars over 3000 BC to AD 3000. The mars-2k texture ships with the app; the record falls back to a flat albedo if it is ever absent.",
    "licence": "Public domain (US government ephemeris and physical facts); Mars texture CC BY 4.0.",
    "modelVersion": "Standish Table 2a (3000 BC-AD 3000) via JPL approximate positions; IAU 2015 via NAIF pck00011.tpc current BODY499 values.",
    "sources": [
      "https://ssd.jpl.nasa.gov/planets/approx_pos.html",
      "https://naif.jpl.nasa.gov/pub/naif/generic_kernels/pck/pck00011.tpc",
      "https://ssd.jpl.nasa.gov/planets/phys_par.html",
      "https://nssdc.gsfc.nasa.gov/planetary/factsheet/marsfact.html",
      "https://www.solarsystemscope.com/textures/"
    ]
  },
  "rotation": {
    "angleUnit": "deg",
    "coefficients": {
      "poleDeclination": 54.432516,
      "poleRateDec": -0.05827105,
      "poleRateRA": -0.10927547,
      "poleRightAscension": 317.269202,
      "primeMeridian": 176.049863,
      "rotationRate": 350.891982443297
    },
    "epochJD": 2451545,
    "frame": "equatorial-j2000",
    "model": "iau-linear",
    "timeConvention": "tt-as-utc",
    "validityEndJD": 2816795,
    "validityStartJD": 625295,
    "version": "1"
  },
  "tier": "major"
}
