{
  "appearance": {
    "absoluteMagnitude": -4.47,
    "albedo": [
      0.65,
      0.65,
      0.65
    ],
    "albedoScale": 1,
    "photometry": {
      "model": "lambert",
      "version": "1"
    },
    "presentation": "sphere",
    "textureID": "venus-2k"
  },
  "assets": [
    {
      "byteLimit": 229696,
      "format": "jpeg",
      "height": 1024,
      "id": "venus-2k",
      "path": "texture.jpg",
      "required": false,
      "sha256": "225012ad4911730605c4e189ca2a3bf674fce50cc48aab4102b936b47d6991ac",
      "width": 2048
    }
  ],
  "capabilities": {
    "enhances": [],
    "requires": [
      "kepler-standish-table2a/1",
      "iau-linear/1",
      "lambert/1"
    ]
  },
  "displayName": "Venus",
  "equatorialRadiusM": 6051800.0,
  "gravitationalParameterM3S2": 324860000000000.0,
  "id": "venus",
  "kind": "body",
  "orbit": {
    "angleUnit": "deg",
    "distanceUnit": "au",
    "elements": {
      "eccentricity": 0.00676399,
      "inclinationDeg": 3.39777545,
      "longitudeOfAscendingNodeDeg": 76.67261496,
      "longitudeOfPerihelionDeg": 131.76755713,
      "meanLongitudeDeg": 181.9797085,
      "rateEccentricity": -5.107e-05,
      "rateInclination": 0.00043494,
      "rateMeanLongitude": 58517.8156026,
      "rateNode": -0.27274174,
      "ratePerihelion": 0.05679648,
      "rateSemiMajorAxis": -2.6e-07,
      "semiMajorAxisAU": 0.72332102
    },
    "epochJD": 2451545.0,
    "frame": "ecliptic-j2000",
    "model": "kepler-standish-table2a",
    "timeConvention": "tt-as-utc",
    "validityEndJD": 2816795.0,
    "validityStartJD": 625295.0,
    "version": "1"
  },
  "parent": "sun",
  "polarRadiusM": 6051800.0,
  "provenance": {
    "accuracy": "Standish Table 2a fit errors for Venus over 3000 BC-AD 3000 (per the approx_pos.html accuracy table): heliocentric longitude 40 arcsec, latitude 30 arcsec, distance 8000 km; over the narrower 1800-2050 AD window the errors are smaller (20 arcsec, 1 arcsec, 4000 km) but this record uses the wide-window fit. Table 2b additional terms apply only to Jupiter through Neptune, so no correction is needed for Venus. Rotation is the secular linear IAU model only (POLE_RA/POLE_DEC/PM linear terms from pck00011.tpc); the quadratic term is zero and periodic nutation terms are omitted. Venus has no measurable oblateness (ellipticity 0.000 in both NAIF BODY299_RADII and the NSSDC fact sheet), so equatorial and polar radii are reported as numerically identical. The albedo triple [0.65, 0.65, 0.65] is a flat split of the single published scalar geometric albedo (0.65) across the three channels, not a per-channel measurement; the shipped Mars record does the same. The texture is a colour map, not a photometric measurement, and does not carry the albedo: the flat albedo above is what the Lambert model scales. The texture is Solar System Scope's Venus atmosphere map, the visible cloud deck, not the radar-derived surface map: it is what an observer would see, and it is not a map of Venus's solid surface.",
    "attribution": "JPL Solar System Dynamics (orbital elements and physical parameters); NAIF / IAU Working Group on Cartographic Coordinates and Rotational Elements (rotation pole and prime meridian); Solar System Scope / INOVE (texture).",
    "coverage": "Heliocentric Venus over 3000 BC to AD 3000. The venus-2k texture ships with the app; the record falls back to a flat albedo if it is ever absent.",
    "licence": "Public domain (US government ephemeris and physical facts). Venus texture CC BY 4.0, quoted from the source page: \"Distributed under Attribution 4.0 International license: You may use, adapt, and share these textures for any purpose, even commercially.\"",
    "modelVersion": "Standish Table 2a (3000 BC-AD 3000) via JPL approximate positions; IAU rotation model via NAIF pck00011.tpc current BODY299 values (the file notes these are unchanged from the 2015 IAU/IAG WGCCRE report).",
    "sources": [
      "https://ssd.jpl.nasa.gov/planets/approx_pos.html",
      "https://naif.jpl.nasa.gov/pub/naif/generic_kernels/pck/pck00011.tpc",
      "https://ssd.jpl.nasa.gov/planets/phys_par.html",
      "https://nssdc.gsfc.nasa.gov/planetary/factsheet/venusfact.html",
      "https://www.solarsystemscope.com/textures/"
    ]
  },
  "rotation": {
    "angleUnit": "deg",
    "coefficients": {
      "poleDeclination": 67.16,
      "poleRateDec": 0.0,
      "poleRateRA": 0.0,
      "poleRightAscension": 272.76,
      "primeMeridian": 160.2,
      "rotationRate": -1.4813688
    },
    "epochJD": 2451545.0,
    "frame": "equatorial-j2000",
    "model": "iau-linear",
    "timeConvention": "tt-as-utc",
    "validityEndJD": 2816795.0,
    "validityStartJD": 625295.0,
    "version": "1"
  },
  "tier": "major"
}
